{
  "schemaVersion": 1,
  "familyName": "Visual Studio Code Codicons",
  "symbolPrefix": "codicon",
  "sourceUrl": "https://github.com/microsoft/vscode-codicons/tree/1c47ab36a4bb845c437866405c2fa67b8ca0fe36/src/icons",
  "revision": "1c47ab36a4bb845c437866405c2fa67b8ca0fe36",
  "colorMode": "monochrome",
  "preview": { "icons": "all" },
  "sprite": {
    "icons": [
      "add", "arrow-left", "chat-sparkle-error", "check", "check-compact", "checklist",
      "chevron-down", "chevron-right-compact", "chevron-up", "circle-slash-compact", "close",
      "cloud-upload", "collection", "copilot", "copy", "debug-restart", "diff", "diff-modified",
      "discard", "download", "edit", "edit-compact", "ellipsis", "error", "folder", "git-branch-compact",
      "git-pull-request-draft", "git-stash-apply", "inbox", "info", "json", "layout-sidebar-right",
      "layout-sidebar-right-off", "list-selection", "lock", "new-session", "open-in-window",
      "open-preview", "pass", "pass-compact", "pass-filled", "question", "save", "search", "shield",
      "shield-compact", "sign-out", "stop-circle", "tasklist", "terminal-compact", "tools", "trash", "warning", "warning-compact"
    ]
  },
  "runtimeFiles": ["sprite.svg", "LICENSE.txt", "ATTRIBUTION.md"]
}
